{
  "translation_schema_version": 1,
  "locale": "uk",
  "provenance": {
    "kind": "migration",
    "reviewer": "owner",
    "evidence": "словы перанесены даслоўна з дзеючых uk-каталогаў (G06.05 #280, G14.04.d #305, вэб 09 §8); запісаная роля uk-рэв'ю — уладар (uk-release-scope §6.4) Дадатак G21.22 (#554): тры запісы web.ui.catalogEmpty/textUnavailableTitle/textUnavailableBody — люстра native-запісу і аўтарскія пераклады з адзнакай сесіі G21.22 у review.note кожнага запісу."
  },
  "records": [
    {
      "id": "native.chrome.access.free",
      "value": "Безкоштовно",
      "reviewedSourceHash": "82e16c5b12218d14ab2c468f999861493c22fd508e1f225f286674ecffbac141",
      "review": {
        "outcome": "approved"
      }
    },
    {
      "id": "native.chrome.access.mixed",
      "value": "Змішано",
      "reviewedSourceHash": "d434ea3d59a4874db509a395e9df857ee017bee8ed9cf40bdf911b4c745459c5",
      "review": {
        "outcome": "approved"
      }
    },
    {
      "id": "native.chrome.access.paid",
      "value": "Платно",
      "reviewedSourceHash": "4b081dc73d3045c6977b49c2140888c6106630d14333a0bc68abd96750d2dffb",
      "review": {
        "outcome": "approved"
      }
    },
    {
      "id": "native.chrome.back",
      "value": "Назад",
      "reviewedSourceHash": "b1138bccd114e81d7e8305ace5a529060269c32c1dd21e669ff30f4a2f36d7a0",
      "review": {
        "outcome": "approved"
      }
    },
    {
      "id": "native.chrome.backToCity",
      "value": "Місто",
      "reviewedSourceHash": "c3196e598662ddc30063829a3d53b88c16855ef719f72189dcb748a4c7e72200",
      "review": {
        "outcome": "approved"
      }
    },
    {
      "id": "native.chrome.cancel",
      "value": "Скасувати",
      "reviewedSourceHash": "0edad8c85ababf7db09011d81672c3470f30745ce80436b8a1e3f77f8fa7150d",
      "review": {
        "outcome": "approved"
      }
    },
    {
      "id": "native.chrome.catalogTemporarilyUnavailable",
      "value": "Каталог тимчасово недоступний",
      "reviewedSourceHash": "1db04f4cab5a569077412e68b581db2461473397a0b1f1ba55ce094f9c65f144",
      "review": {
        "outcome": "approved"
      }
    },
    {
      "id": "native.chrome.catalogUnavailable",
      "value": "Каталог недоступний",
      "reviewedSourceHash": "5da4e9377f0d520cf9f61c7ff0fa655d10fd902089cdd63b979ff8f8d19d0745",
      "review": {
        "outcome": "approved"
      }
    },
    {
      "id": "native.chrome.collectionUnavailable",
      "value": "Підбірка недоступна",
      "reviewedSourceHash": "f835b71196437961eeaeb3074ef18024e8204716abc2801515bbdf6a8c4b51d3",
      "review": {
        "outcome": "approved"
      }
    },
    {
      "id": "native.chrome.collectionUnresolved",
      "value": "Деякі члени підбірки ще не опубліковані.",
      "reviewedSourceHash": "a5e630ad534dffdc7196d67ccc73dd0266f09f81d681a7a5b811a354ab5fd20b",
      "review": {
        "outcome": "approved"
      }
    },
    {
      "id": "native.chrome.currentWalk",
      "value": "Поточна прогулянка",
      "reviewedSourceHash": "f9408779fd160eda48f9d52e41c0a274afa34f1fc10c34ed16c655a630413f88",
      "review": {
        "outcome": "approved"
      }
    },
    {
      "id": "native.chrome.degradedData",
      "value": "Частина даних тимчасово недоступна",
      "reviewedSourceHash": "c6a254fe804abb64bc54bbe20e172db06ed99322075f21a9f868ba5e35a923b1",
      "review": {
        "outcome": "approved"
      }
    },
    {
      "id": "native.chrome.demoNearbyMapAccessibility",
      "value": "Прикладна схема трьох зупинок",
      "reviewedSourceHash": "0e0f487df8a6cdd6b102b55fad23fd34872990e187a2f2ff8045950fbfa6b419",
      "review": {
        "outcome": "approved",
        "note": "Codex-authored demo copy; review with this PR."
      }
    },
    {
      "id": "native.chrome.demoNearbyMapLabel",
      "value": "Схема прогулянки · демо",
      "reviewedSourceHash": "1829b6458dc887619cb8377e2ac100758f5cad90061438a550be0a620fa1e833",
      "review": {
        "outcome": "approved",
        "note": "Codex-authored demo copy; review with this PR."
      }
    },
    {
      "id": "native.chrome.demoNoticeDetail",
      "value": "Історії, зупинки та звуки тут зразкові. Цей маршрут не призначений для навігації.",
      "reviewedSourceHash": "25cbc93df0b908ae3ae7b81353ad38253b44c79bc3fd50fedebf5e9391b819e8",
      "review": {
        "outcome": "approved",
        "note": "Codex-authored demo copy; review with this PR."
      }
    },
    {
      "id": "native.chrome.demoRunMapLabel",
      "value": "Схема зупинок · демо",
      "reviewedSourceHash": "2b2cf7128548b97eb8fdc8ed19819669c87c9b8afa19d11ac8a9f77706552f4b",
      "review": {
        "outcome": "approved",
        "note": "Codex-authored demo copy; review with this PR."
      }
    },
    {
      "id": "native.chrome.demoVersion",
      "value": "Демонстраційна версія",
      "reviewedSourceHash": "0840fd5f0145a4f2d62a33cc2c765c6d5d478fc0b5591a3fc165311437e3d25d",
      "review": {
        "outcome": "approved",
        "note": "Codex-authored demo copy; review with this PR."
      }
    },
    {
      "id": "native.chrome.differenceText.duration_unknown",
      "value": "час не оцінено",
      "reviewedSourceHash": "aa5a112078a2bbce5d31cfb2eaf8e7ffc469607accdc26f9e44e18b8d6dbe659",
      "review": {
        "outcome": "approved"
      }
    },
    {
      "id": "native.chrome.differenceText.over_time",
      "value": "довше за запит",
      "reviewedSourceHash": "95f858f684ec50f63854358e44ef3e68fb7c3c322ff5732fc957046244703404",
      "review": {
        "outcome": "approved"
      }
    },
    {
      "id": "native.chrome.differenceText.season_not_recommended",
      "value": "не для цього сезону",
      "reviewedSourceHash": "b3976a641f5d9d01ed1186b8256e629a92bff51fc5f65f14563df0f60da468d0",
      "review": {
        "outcome": "approved"
      }
    },
    {
      "id": "native.chrome.differenceText.season_unassessed",
      "value": "сезон не оцінено",
      "reviewedSourceHash": "e06820b8dbcdffc5d4e083b1b251714326a070dd61d11c589dc48b1ab551da42",
      "review": {
        "outcome": "approved"
      }
    },
    {
      "id": "native.chrome.differenceText.theme_mismatch",
      "value": "інша тема",
      "reviewedSourceHash": "518dfdb5f1459fb582bff8fef2e6f5130e9b6277546581bb5c06a49da31312e4",
      "review": {
        "outcome": "approved"
      }
    },
    {
      "id": "native.chrome.discoveryAlternatives",
      "value": "Інші варіанти",
      "reviewedSourceHash": "6b9f5202ccfa8bebff4109104041f656688d06f08ddaa652292d65f40af5ba0e",
      "review": {
        "outcome": "approved"
      }
    },
    {
      "id": "native.chrome.discoveryEmpty",
      "value": "Нічого точно не підходить — послабте вибір або подивіться інші варіанти.",
      "reviewedSourceHash": "831cdd7dfd6d729661152d21f5c107ebf2438ec405db988ddc8d2cd62633521d",
      "review": {
        "outcome": "approved"
      }
    },
    {
      "id": "native.chrome.discoveryTemporarilyUnavailable",
      "value": "Підбір зараз недоступний",
      "reviewedSourceHash": "9252d5d0294115694f781e58a88257ae4b90cca39cb8c14091efd477f0721935",
      "review": {
        "outcome": "approved"
      }
    },
    {
      "id": "native.chrome.discoveryTitle",
      "value": "Чим зайнятися",
      "reviewedSourceHash": "73a869d121cfe785ef9b06081df8484b6a878a6bb51140ad668c80a4357bd816",
      "review": {
        "outcome": "approved"
      }
    },
    {
      "id": "native.chrome.discoveryUnavailable",
      "value": "Підбір недоступний",
      "reviewedSourceHash": "262a86e4e8647e231e8d140b8e62fdbf5d769ab8c08400d9d87afb962676211a",
      "review": {
        "outcome": "approved"
      }
    },
    {
      "id": "native.chrome.durationLabel",
      "value": "Тривалість",
      "reviewedSourceHash": "367751046f034b1e95b6562ea3eb4809debffb78ea7af63d3de645321bdeecc9",
      "review": {
        "outcome": "approved"
      }
    },
    {
      "id": "native.chrome.durationMinutes",
      "value": "Час: ${minutes} хв",
      "reviewedSourceHash": "e9a5925bfd57c9831a26edeecf7bcb583cbd7d875c8e9fabbbd4d10449028fe4",
      "review": {
        "outcome": "approved"
      }
    },
    {
      "id": "native.chrome.durationRange",
      "value": "Час: від ${minMinutes} до ${maxMinutes} хв",
      "reviewedSourceHash": "78add4278ac05d6aa17374a52f30bb5c313f6da5834ace6e464ed213dcafeee9",
      "review": {
        "outcome": "approved"
      }
    },
    {
      "id": "native.chrome.freeStopsCount",
      "value": "Точок безкоштовно: ${count}",
      "reviewedSourceHash": "780c5d18130bb93df4355222162c7d4d8cc0cc3510971a9e6376751dff00a953",
      "review": {
        "outcome": "approved"
      }
    },
    {
      "id": "native.chrome.guidesLink",
      "value": "Гіди →",
      "reviewedSourceHash": "ae59ec899a5964dea00463b49e7dd6348684069736ce95f6183d3c79b94c389c",
      "review": {
        "outcome": "approved"
      }
    },
    {
      "id": "native.chrome.heardCount",
      "value": "прослухано: ${count}",
      "reviewedSourceHash": "974ee6f7afa147c26e872b3306efc390dbf3446e84d770041ded77527ab0342a",
      "review": {
        "outcome": "approved"
      }
    },
    {
      "id": "native.chrome.historyUnavailable",
      "value": "Історія недоступна.",
      "reviewedSourceHash": "e533a4767a8b973cf00efbfea8c16a7163f08f541ae657e853eea36baa0ccdc9",
      "review": {
        "outcome": "approved"
      }
    },
    {
      "id": "native.chrome.kudyLink",
      "value": "KUDY →",
      "reviewedSourceHash": "6215ec8b2ead10ed524e46f5c1ddd0a0567f909e21330a8e7a0229422917383b",
      "review": {
        "outcome": "approved"
      }
    },
    {
      "id": "native.chrome.languageLabel",
      "value": "Мова",
      "reviewedSourceHash": "85cd11e030ecf41b369de4b859dfd71a507a92c832924c27ff037d43425b9c92",
      "review": {
        "outcome": "approved"
      }
    },
    {
      "id": "native.chrome.languageSelfNames.be",
      "value": "Беларуская",